{
  "componentName": "AlertBanner",
  "props": {
    "message": "System update scheduled",
    "severity": "info"
  },
  "status": "pass",
  "provenance": {
    "agent": "claude-3.5-sonnet",
    "registry": "local",
    "compiledAt": "2026-02-26T16:00:00.000Z",
    "compilerVersion": "0.1.0"
  },
  "errors": [],
  "selfCorrectionAttempts": 0
}
